<?xml version="1.0"?>

<!DOCTYPE webpage SYSTEM "tn5250.dtd">

<?xml-stylesheet href="tn5250.xsl" type="text/xml"?>

<webpage xml:lang="en">
  <head>
    <title>Developer Resources</title>
    <trail href="./">tn5250</trail>
  </head>

  <body>
    <h1>tn5250 Developer Resources</h1>

    <h2 id="ietf">IETF</h2>

    <p>The
      <a href="http://www.ietf.org/html.charters/OLD/tn3270e-charter.html">IETF
        tn3270e Working Group</a> defined standards for 3270 and
      5250 over TCP/IP.  These standards make use of the existing
      Telnet standards.</p>

    <dl>
      <dt><rfc number="854"/></dt>
      <dd>Telnet Protocol Specification</dd>

      <dt><rfc number="855"/></dt>
      <dd>Telnet Option Specifications</dd>

      <dt><rfc number="856"/></dt>
      <dd>Telnet Binary Transmission</dd>

      <dt><rfc number="860"/></dt>
      <dd>Telnet Timing Mark Option</dd>

      <dt><rfc number="885"/></dt>
      <dd>Telnet End Of Record Option</dd>

      <dt><rfc number="1091"/></dt>
      <dd>Telnet Terminal-Type Option</dd>

      <dt><rfc number="1205"/></dt>
      <dd>5250 Telnet Interface</dd>

      <dt><rfc number="1572"/></dt>
      <dd>Telnet Environment Option</dd>

      <dt><rfc number="2877"/></dt>
      <dd>5250 Telnet Enhancements.  This standard extends RFC 1205
	and includes a useful list of references in section 13.</dd>
    </dl>

    <h2 id="ibm">IBM</h2>

    <p>These documents are available online from IBM and include
      information relevant to the tn5250 project.</p>

    <dl>
      <dt><ibmbook code="CO2E2001" pubnum="SC30-3533-03"/></dt>
      <dd>5494 Remote Control Unit, Functions Reference.</dd>

      <dt><ibmbook code="CO2A2002" pubnum="GA27-3960-05"/></dt>
      <dd>5494 Remote Control Unit, Userâ€™s Guide.</dd>

      <dt><ibmbook code="QB3AQ501" pubnum="SC41-5603-01"/></dt>
      <dd>AS/400 International Application Development V4R2.
	Appendices A and F describe the EBCDIC and ASCII character
	sets that the AS/400 supports.</dd>

      <dt><ibmbook code="QB3AWC01" pubnum="SC41-5101-01"/></dt>
      <dd>AS/400 National Language Support V4R2.  Further information
	about character sets, especially as it relates to display
	devices.</dd>

      <dt><ibmbook code="FOCREF00" pubnum="SC09-2190-01"/></dt>
      <dd>CDRA Reference.  Even more information about how character
	sets work on the AS/400, and how conversion between them
	should work.</dd>

      <dt><ibmbook code="QB3ANB00" pubnum="SC41-5401-00"/></dt>
      <dd>OS/400 Communications Configuration V4R1.  Chapter 8 defines
	the parameters that may be passed to the AS/400 over the
	telnet connection to configure the display or printer device.</dd>

      <dt><a href="pwsubciw.zip">PWSUBS</a> (Zip file)</dt>
      <dd>APPC Password Substitution.  This describes the scheme used
        for automatic signon, which is currently unimplemented in tn5250.</dd>
    </dl>
  </body>
</webpage>
